availability,catchcopy,medium_image_url_1,medium_image_url_2,medium_image_url_3,small_image_url_1,small_image_url_2,small_image_url_3,affiliate_rate,affiliate_url,asuraku_area,asuraku_closing_time,asuraku_flag,credit_card_flag,end_time,genre_id,gift_flag,image_flag,item_caption,product_id,item_name,item_price,item_price_base_field,item_price_max_1,item_price_max_2,item_price_max_3,item_price_min_1,item_price_min_2,item_price_min_3,item_url,point_rate,point_rate_end_time,point_rate_start_time,postage_flag,review_average,review_count,ship_overseas_area,ship_overseas_flag,shop_affiliate_url,shop_code,shop_name,shop_of_the_year_flag,shop_url,start_time,tag_ids,tax_flag
1,ちふれ 口紅(詰替用) 口紅・リップグロス 【3980円以上で送料無料】,https://thumbnail.image.rakuten.co.jp/@0_mall/cosmecomonline/cabinet/item-img2007/item_1000099332_1.jpg?_ex=128x128,https://thumbnail.image.rakuten.co.jp/@0_mall/cosmecomonline/cabinet/item-img2007/item_1000099332_2.jpg?_ex=128x128,https://thumbnail.image.rakuten.co.jp/@0_mall/cosmecomonline/cabinet/item-img2007/item_1000099332_3.jpg?_ex=128x128,https://thumbnail.image.rakuten.co.jp/@0_mall/cosmecomonline/cabinet/item-img2007/item_1000099332_1.jpg?_ex=64x64,https://thumbnail.image.rakuten.co.jp/@0_mall/cosmecomonline/cabinet/item-img2007/item_1000099332_2.jpg?_ex=64x64,https://thumbnail.image.rakuten.co.jp/@0_mall/cosmecomonline/cabinet/item-img2007/item_1000099332_3.jpg?_ex=64x64,4,https://hb.afl.rakuten.co.jp/hgc/g00qawwg.ppohcba6.g00qawwg.ppohdea5/?pc=https%3A%2F%2Fitem.rakuten.co.jp%2Fcosmecomonline%2F1000099332%2F&m=http%3A%2F%2Fm.rakuten.co.jp%2Fcosmecomonline%2Fi%2F10137829%2F&rafcid=wsc_i_is_1053351987856881203,,,0,1,2038-01-01 00:00,503106,0,1,「ちふれ 美容液 ノンアルコールタイプ」と同じ濃度（0.2％）の保湿成分ヒアルロン酸を配合。なめらかにのびて、くちびるにフィット。しっとり、ふっくらとした女性らしい口もとを演出します。 別売りのケースと組み合わせて、オリジナルの口紅を楽しめます。　　・カラー：549レッド系パール・【美容液と同じ保湿成分配合】保湿成分ヒアルロン酸を、ちふれ美容液ノンアルコールタイプと同じ濃度（0.2％）で配合した口紅です。・【しっとりとした使い心地】なめらかに伸びて、唇にフィットするリップスティック。うるおいを守って乾燥を防ぎ、しっとりふっくらとした口元を演出します。・【ケースで自由にカスタマイズ】別売りの口紅ケースと組み合わせて、オリジナルの口紅を楽しめます。・無香料、界面活性剤不使用、グリセリンフリー、パラベンフリー、防腐剤不使用、シリコンフリー、無鉱物油・保湿成分：ヒアルロン酸配合・油性エモリエント成分：マカデミア種子油配合・ケース別売り※こちらの商品はケースは付属しません。【使い方】なめらかでしっとりうるおう口紅。お好きな専用ケース（別売り）にセットしてお使いください。 ブランド名ちふれ 商品名口紅(詰替用) カテゴリメイクアップ ＞ 口紅・リップグロス ＞ 口紅カラー展開S549カラーをすべて見る成　分マイカ 適量・酸化鉄 適量・酸化チタン 適量・黄5 適量・赤202 適量・青1 適量・硫酸Ba 適量（着色成分）、オクチルドデカノール 10.52％・トリエチルヘキサノイン 9.56％・ヘキシルデカノール 7.65％・パラフィン 7.63％・リンゴ酸ジイソステアリル 5.74％・マイクロクリスタリンワックス 3.84％・ミツロウ 2.12％・カルナウバロウ 1.70％ マカデミアナッツ油 0.95％（油性エモリエント成分）、ヒアルロン酸Na 0.20％（保湿成分）、水酸化Al 適量（表面処理剤）、トコフェロール 0.02％（製品の酸化防止剤）、BHT 適量（成分の酸化防止剤）、ヒマシ油 全量を100％とする（基剤）メーカー・販売業者株式会社ちふれ化粧品 愛用者室（成分や商品のお問い合わせ）　（商品に関するお問合せ）区　分 化粧品JANコード4974972218212広告文責株式会社アイスタイルリテール　03-5575-1272,cosmecomonline:10137829,「ポイント15倍 7月1日」 ちふれ 口紅(詰替用) S549 詰替え 口紅・リップグロス アットコスメ _24Jul,385,item_price_min3,385,385,385,385,385,385,https://hb.afl.rakuten.co.jp/hgc/g00qawwg.ppohcba6.g00qawwg.ppohdea5/?pc=https%3A%2F%2Fitem.rakuten.co.jp%2Fcosmecomonline%2F1000099332%2F&m=http%3A%2F%2Fm.rakuten.co.jp%2Fcosmecomonline%2Fi%2F10137829%2F&rafcid=wsc_i_is_1053351987856881203,15,2024-07-01 23:59,2024-07-01 00:00,1,0,0,,0,https://hb.afl.rakuten.co.jp/hgc/g00qawwg.ppohcba6.g00qawwg.ppohdea5/?pc=https%3A%2F%2Fwww.rakuten.co.jp%2Fcosmecomonline%2F&m=http%3A%2F%2Fm.rakuten.co.jp%2Fcosmecomonline%2F&rafcid=wsc_i_is_1053351987856881203,cosmecomonline,アットコスメショッピング,0,https://hb.afl.rakuten.co.jp/hgc/g00qawwg.ppohcba6.g00qawwg.ppohdea5/?pc=https%3A%2F%2Fwww.rakuten.co.jp%2Fcosmecomonline%2F&m=http%3A%2F%2Fm.rakuten.co.jp%2Fcosmecomonline%2F&rafcid=wsc_i_is_1053351987856881203,2019-04-19 00:00,,0
1,,https://thumbnail.image.rakuten.co.jp/@0_mall/irecosmetic/cabinet/07879433/imgrc0115159418.jpg?_ex=128x128,https://thumbnail.image.rakuten.co.jp/@0_mall/irecosmetic/cabinet/07873621/imgrc0105785658.jpg?_ex=128x128,https://thumbnail.image.rakuten.co.jp/@0_mall/irecosmetic/cabinet/07873621/imgrc0105785659.jpg?_ex=128x128,https://thumbnail.image.rakuten.co.jp/@0_mall/irecosmetic/cabinet/07879433/imgrc0115159418.jpg?_ex=64x64,https://thumbnail.image.rakuten.co.jp/@0_mall/irecosmetic/cabinet/07873621/imgrc0105785658.jpg?_ex=64x64,https://thumbnail.image.rakuten.co.jp/@0_mall/irecosmetic/cabinet/07873621/imgrc0105785659.jpg?_ex=64x64,4,https://hb.afl.rakuten.co.jp/hgc/g00ty2gg.ppohcca4.g00ty2gg.ppohd0d6/?pc=https%3A%2F%2Fitem.rakuten.co.jp%2Firecosmetic%2F10275%2F&m=http%3A%2F%2Fm.rakuten.co.jp%2Firecosmetic%2Fi%2F10000290%2F&rafcid=wsc_i_is_1053351987856881203,,,0,1,,503106,0,1,商品詳細 広告文責 (株) IREcosmetic ＋82-10-8489-2134 メーカー名 テイク(株) (株)エイブルCNC 輸入者名 本商品は個人輸入商品のため、購入者の方が輸入者となります。 原産国 韓国製 商品区分 化粧品 全成分 [ガンファイア 0.25g3.5*35mm] C12-15アルキルエチルヘキサノエート、マイカ、セレシン、ダイフェニルシロキシフェニルトライメティコン、オゾケライト、ハイドロジェネイテッドポリデセン、マイクロクリスタルワックス、黄色5号(CI15985)、アイソヘキサデカン、カナウバワックス、ポリエチレン、赤色201号(CI15985)、赤紫ト、ハイドロジェネイテッドポリデセン、マイクロクリスタルリンワックス、アイソヘキサデカン、カナウバワックス、チタンデオキサイド(CI77891)、カプリクカプリクミリスティックステアリクトライグリセライド、フェノキシエタノール、黄色5号(CI15985)、赤色202号(CI1550)、カプリクミリスティックステアリクトライグリセライド、フェノキシエタノール、黄色5号(CI15985)、赤色202号(CI1550)、サデカン、カナウバワックス、ポリエチレン、カプリリックカプリスティックステアリックトライセライド、赤色酸化鉄（CI77491）、フェノキシエタノール、赤色201号（CI15850）、シアバター、シリカ、香料、アボカドイル、トコフェリルアセテート、ベンジルベンゾエートエキス、ブルーベリーエキス、シリカ、香料、プロピルパラベン[コーヒーベリー0.25g3.5*35mm] C12-15アルキルエチルヘキサノエート、マイカ、セレシン、ダイフェニルシロキシフェニルトライメティコン、オゾケライト、ハイドロジェネイテッドポリデセン、マイクロクリスタルワックス、アイソヘキサデカン、カナタニウム酸塩、レシン、ジフェニルシフェニルトライメチコン、オゾケライト、ハイドロジェネイテッドポリデセン、マイクロクリスタルワックス、アイソヘキサデカン、カナウバワックス、赤色202号（CI15850）、ポリエチレン、赤色218号（CI45410）、カプリリックカプリクミリスティックステアリクトライセライド、赤色201号(CI15850)、アイソヘキサデカン、カナウバワックス、黄色5号(CI15985)、ポリエチレン、カプリックミリスティックステアリクトライセライド、フェノキシエタノール、黒色酸化鉄(CI77499)、シアバター、シリカ、香料、アボカドイル、トコフェリルアセテート、ベンジルベンゾエイト] [アップル]オール、シアバター、シリカ、香料、アボカドオイル、トコフェリルアセテート、ベンジルベンゾエイト[オフコラル0.25g] C12-15アルキルエチルヘキサノエート、マイカ、セレシン、ダイフェニルシロキシフェニルトライメティコン、オゾケライト、ハイドロジェネイテッドポリデセン、マイクロクリスタルワックス、アイソヘキサノエートロクシフェニルトライメティコン、オゾケライト、ハイドロジェネイテッドポリデセン、マイクロクリスタルワックス、赤色酸化鉄(CI77491)、アイソヘキサデカン、カナウバワックス、ポリエチレン、カプリリックカプリクミリスティックステアリクトライグリセライド、赤色202号(CI15850)、チタンデオキシドオキサイド(CI77891)、フェチレン、カプリリクカプリカーベリカテイトオリル、赤色202号(CI15550)、チタンデオキサイド(CI77891)、チタ 内容量 0.25g 【注意事項】 ・当店でご購入された商品は、原則として、「個人輸入」としての取り扱いになり、全て韓国のソウルからお客様のもとへ直送されます。 ・個人輸入される商品は、全てご注文者自身の「個人使用・個人消費」が前提となりますので、ご注文された商品を第三者へ譲渡・転売することは法律で禁止されております。 ・通関時に関税・輸入消費税が課税される可能性があります。課税額はご注文時には確定しておらず、通関時に確定しますので、商品の受け取り時に着払いでお支払いください。詳細はこちらご確認下さい。 ＊色がある場合、モニターの発色の具合によって実際のものと色が異なる場合がある。,irecosmetic:10000290,＼ミシャ／シルキーラスティングリップペンシル/リップライナー/リップ/口紅/ティント/マット/MISSHA/Silky Lasting Lip Pencil,390,item_price_min3,390,390,390,390,390,390,https://hb.afl.rakuten.co.jp/hgc/g00ty2gg.ppohcca4.g00ty2gg.ppohd0d6/?pc=https%3A%2F%2Fitem.rakuten.co.jp%2Firecosmetic%2F10275%2F&m=http%3A%2F%2Fm.rakuten.co.jp%2Firecosmetic%2Fi%2F10000290%2F&rafcid=wsc_i_is_1053351987856881203,1,,,1,5,1,,0,https://hb.afl.rakuten.co.jp/hgc/g00ty2gg.ppohcca4.g00ty2gg.ppohd0d6/?pc=https%3A%2F%2Fwww.rakuten.co.jp%2Firecosmetic%2F&m=http%3A%2F%2Fm.rakuten.co.jp%2Firecosmetic%2F&rafcid=wsc_i_is_1053351987856881203,irecosmetic,IREcosmetic,0,https://hb.afl.rakuten.co.jp/hgc/g00ty2gg.ppohcca4.g00ty2gg.ppohd0d6/?pc=https%3A%2F%2Fwww.rakuten.co.jp%2Firecosmetic%2F&m=http%3A%2F%2Fm.rakuten.co.jp%2Firecosmetic%2F&rafcid=wsc_i_is_1053351987856881203,,,0
1,ブラシ付き彩りリップライナー,https://thumbnail.image.rakuten.co.jp/@0_mall/rouge/cabinet/item105/r-242141.jpg?_ex=128x128,https://thumbnail.image.rakuten.co.jp/@0_mall/rouge/cabinet/item105/r-242141-1.jpg?_ex=128x128,,https://thumbnail.image.rakuten.co.jp/@0_mall/rouge/cabinet/item105/r-242141.jpg?_ex=64x64,https://thumbnail.image.rakuten.co.jp/@0_mall/rouge/cabinet/item105/r-242141-1.jpg?_ex=64x64,,4,https://hb.afl.rakuten.co.jp/hgc/g00pv9dg.ppohc2c6.g00pv9dg.ppohd2e9/?pc=https%3A%2F%2Fitem.rakuten.co.jp%2Frouge%2Fr-242141%2F&m=http%3A%2F%2Fm.rakuten.co.jp%2Frouge%2Fi%2F10435392%2F&rafcid=wsc_i_is_1053351987856881203,,,0,1,,503106,0,1,なめらかな描き心地のソフトな芯でスルスルと描いて唇をカラーリング。 リップライナーとして唇の輪郭を整えることも、唇全体を彩ることもできます。 唇にピタッと均一に密着し、ヨレにくくきれいに発色。 肌あたりのよいリップブラシ付きで、手を汚さずに色をぼかせます。 ■くり出し式、ブラシ付き　 ■韓国製 容量　0.2G 全成分 トリエチルヘキサノイン、セレシン、水添野菜油、トリ（カプリル酸／カプリン酸／ミリスチン酸／ステアリン酸）グリセリル、エチルヘキサン酸アルキル（C12−15）、リンゴ酸ジイソステアリル、ポリエチレン、合成ワックス、マイクロクリスタリンワックス、シリカ、セスキオレイン酸ソルビタン、香料、カプリル酸グリセリル、ジメチコン、（＋／−）酸化チタン、マイカ、酸化鉄、赤202、赤201、黄4、黄5 注意事項 芯を出しすぎると折れの原因となりますので、くり出しすぎないようにご注意ください。 ブラシご使用後は筆先をティッシュペーパー等で拭き取り、つねに清潔な状態を保ってください。 ●メーカー 　　 エフエムジー&ミッション●区分　　　　　韓国製・化粧品アップ●分類　　　　　リップライナー●広告文責　　株式会社ルージュ 03-3980-1585テスター品 試用見本品 半額以下な掘り出しもの満載 噂の『特価品』はココをクリック外箱不良 箱つぶれ 箱なし 難あり 在庫処分 キズ有 アウトレットなどですが激レアな商品が見つかるかも…商品の発売日・カラー種類・タイプなどの商品の詳細情報につきましては各商品の発売元・製造メーカーに直接お問い合わせください。それらのお問い合わせおよび特価品に関するご質問は一切お答えしません。ご了承ください。ご注文その他の事を問い合わせ希望の方はご質問前にこちらのページをよくお読みください。よくある質問集,rouge:10435392,エフエムジー&ミッション エフエムジーティー クリーミー タッチ リップライナー 【メール便対象品】,413,item_price_min3,413,413,413,413,413,413,https://hb.afl.rakuten.co.jp/hgc/g00pv9dg.ppohc2c6.g00pv9dg.ppohd2e9/?pc=https%3A%2F%2Fitem.rakuten.co.jp%2Frouge%2Fr-242141%2F&m=http%3A%2F%2Fm.rakuten.co.jp%2Frouge%2Fi%2F10435392%2F&rafcid=wsc_i_is_1053351987856881203,1,,,1,0,0,アルゼンチン/オーストリア/オーストラリア/ベルギー/ブラジル/カナダ/スイス/中国/ドイツ/デンマーク/スペイン/フランス/英国/ギリシャ/香港/インドネシア/インド/イタリア/韓国/モロッコ/メキシコ/マレーシア/オランダ/ニュージーランド/フィリピン/ポーランド/ポルトガル/スウェーデン/シンガポール/タイ/トルコ/台湾/アメリカ/ベトナム,1,https://hb.afl.rakuten.co.jp/hgc/g00pv9dg.ppohc2c6.g00pv9dg.ppohd2e9/?pc=https%3A%2F%2Fwww.rakuten.co.jp%2Frouge%2F&m=http%3A%2F%2Fm.rakuten.co.jp%2Frouge%2F&rafcid=wsc_i_is_1053351987856881203,rouge,化粧品ディスカウント店　ルージュ,0,https://hb.afl.rakuten.co.jp/hgc/g00pv9dg.ppohc2c6.g00pv9dg.ppohd2e9/?pc=https%3A%2F%2Fwww.rakuten.co.jp%2Frouge%2F&m=http%3A%2F%2Fm.rakuten.co.jp%2Frouge%2F&rafcid=wsc_i_is_1053351987856881203,,,0
1,リップライン用。美しいラインが描けます。口紅のにじみ防止に。,https://thumbnail.image.rakuten.co.jp/@0_mall/rouge/cabinet/06443308/imgrc0073039656.jpg?_ex=128x128,https://thumbnail.image.rakuten.co.jp/@0_mall/rouge/cabinet/item100/r-20160580.jpg?_ex=128x128,,https://thumbnail.image.rakuten.co.jp/@0_mall/rouge/cabinet/06443308/imgrc0073039656.jpg?_ex=64x64,https://thumbnail.image.rakuten.co.jp/@0_mall/rouge/cabinet/item100/r-20160580.jpg?_ex=64x64,,4,https://hb.afl.rakuten.co.jp/hgc/g00pv9dg.ppohc2c6.g00pv9dg.ppohd2e9/?pc=https%3A%2F%2Fitem.rakuten.co.jp%2Frouge%2Fsp-r-20160580%2F&m=http%3A%2F%2Fm.rakuten.co.jp%2Frouge%2Fi%2F10433744%2F&rafcid=wsc_i_is_1053351987856881203,,,0,1,2024-07-13 09:59,503106,0,1,メール便をご利用の方は必ず以下ページをご確認ください。 社名変更により製造時期によって新旧異なる社名の記載品でのお届けとなる場合がございます。また、社名変更にともない商品のパッケージが画像とは異なる場合がございます。あらかじめご了承くださいませ。新社名「FMGMISSION (エフエムジー & ミッション)」 旧社名「エイボン」 メーカー希望小売価格はメーカーカタログに基づいて掲載しています。 リップライン用。美しいラインが描けます。 口紅のにじみ防止に。 ●メーカー 　　 エイボン●区分　　　　　日本製・化粧品アップ●分類　　　　　リップライナー●広告文責　　株式会社ルージュ 03-3980-1585テスター品 試用見本品 半額以下な掘り出しもの満載 噂の『特価品』はココをクリック外箱不良 箱つぶれ 箱なし 難あり 在庫処分 キズ有 アウトレットなどですが激レアな商品が見つかるかも…商品の発売日・カラー種類・タイプなどの商品の詳細情報につきましては各商品の発売元・製造メーカーに直接お問い合わせください。それらのお問い合わせおよび特価品に関するご質問は一切お答えしません。ご了承ください。ご注文その他の事を問い合わせ希望の方はご質問前にこちらのページをよくお読みください。よくある質問集,rouge:10433744,AVON エイボン ソフト スティック リップライナー 【メール便対象品】,372,item_price_min3,372,372,372,372,372,372,https://hb.afl.rakuten.co.jp/hgc/g00pv9dg.ppohc2c6.g00pv9dg.ppohd2e9/?pc=https%3A%2F%2Fitem.rakuten.co.jp%2Frouge%2Fsp-r-20160580%2F&m=http%3A%2F%2Fm.rakuten.co.jp%2Frouge%2Fi%2F10433744%2F&rafcid=wsc_i_is_1053351987856881203,1,,,1,0,0,アルゼンチン/オーストリア/オーストラリア/ベルギー/ブラジル/カナダ/スイス/中国/ドイツ/デンマーク/スペイン/フランス/英国/ギリシャ/香港/インドネシア/インド/イタリア/韓国/モロッコ/メキシコ/マレーシア/オランダ/ニュージーランド/フィリピン/ポーランド/ポルトガル/スウェーデン/シンガポール/タイ/トルコ/台湾/アメリカ/ベトナム,1,https://hb.afl.rakuten.co.jp/hgc/g00pv9dg.ppohc2c6.g00pv9dg.ppohd2e9/?pc=https%3A%2F%2Fwww.rakuten.co.jp%2Frouge%2F&m=http%3A%2F%2Fm.rakuten.co.jp%2Frouge%2F&rafcid=wsc_i_is_1053351987856881203,rouge,化粧品ディスカウント店　ルージュ,0,https://hb.afl.rakuten.co.jp/hgc/g00pv9dg.ppohc2c6.g00pv9dg.ppohd2e9/?pc=https%3A%2F%2Fwww.rakuten.co.jp%2Frouge%2F&m=http%3A%2F%2Fm.rakuten.co.jp%2Frouge%2F&rafcid=wsc_i_is_1053351987856881203,2024-06-29 10:00,,0
1,貝印/cosmeup/リップブラシ/スライドタイプ,https://thumbnail.image.rakuten.co.jp/@0_mall/k-benkyo/cabinet/shohin128/4901601308082.jpg?_ex=128x128,,,https://thumbnail.image.rakuten.co.jp/@0_mall/k-benkyo/cabinet/shohin128/4901601308082.jpg?_ex=64x64,,,4,https://hb.afl.rakuten.co.jp/hgc/g00ristg.ppohc783.g00ristg.ppohdae9/?pc=https%3A%2F%2Fitem.rakuten.co.jp%2Fk-benkyo%2F4901601308082%2F&m=http%3A%2F%2Fm.rakuten.co.jp%2Fk-benkyo%2Fi%2F10172500%2F&rafcid=wsc_i_is_1053351987856881203,,,0,1,,503106,0,1,※パッケージデザイン等は予告なく変更されることがあります。予め御了承下さい。商品特徴・なめらかでコシのあるリップブラシ。 ・ブラシのエッジで唇の輪郭を取るのに最適。・携帯に便利なスライドタイプです。材質毛：PBT口金：アルミニウム キャップ、本体：ポリカーボネート中芯：AS樹脂バネ：ステンレススチール注意事項 ・乳幼児の手が届かない安全な場所に保管してください。・ご使用後はティッシュペーパー等でやさしく拭き取ってください。 ・汚れが気になる時は、ぬるま湯で軽く振り洗いし、十分すすいだ後、乾いたタオルで水気を切り、形を整えて陰干ししてください。広告文責 くすりの勉強堂TEL 0248-94-8718■発売元：貝印株式会社,k-benkyo:10172500,貝印 コスメアップ スライドリップブラシ 先丸 HC3749,423,item_price_min3,423,423,423,423,423,423,https://hb.afl.rakuten.co.jp/hgc/g00ristg.ppohc783.g00ristg.ppohdae9/?pc=https%3A%2F%2Fitem.rakuten.co.jp%2Fk-benkyo%2F4901601308082%2F&m=http%3A%2F%2Fm.rakuten.co.jp%2Fk-benkyo%2Fi%2F10172500%2F&rafcid=wsc_i_is_1053351987856881203,1,,,1,0,0,,0,https://hb.afl.rakuten.co.jp/hgc/g00ristg.ppohc783.g00ristg.ppohdae9/?pc=https%3A%2F%2Fwww.rakuten.co.jp%2Fk-benkyo%2F&m=http%3A%2F%2Fm.rakuten.co.jp%2Fk-benkyo%2F&rafcid=wsc_i_is_1053351987856881203,k-benkyo,くすりの勉強堂 アネックス,0,https://hb.afl.rakuten.co.jp/hgc/g00ristg.ppohc783.g00ristg.ppohdae9/?pc=https%3A%2F%2Fwww.rakuten.co.jp%2Fk-benkyo%2F&m=http%3A%2F%2Fm.rakuten.co.jp%2Fk-benkyo%2F&rafcid=wsc_i_is_1053351987856881203,,,0
1,リップライン用。美しいラインが描けます。口紅のにじみ防止に。,https://thumbnail.image.rakuten.co.jp/@0_mall/tokyo-cosmetics/cabinet/item102/item102/imgrc0074992186.jpg?_ex=128x128,https://thumbnail.image.rakuten.co.jp/@0_mall/tokyo-cosmetics/cabinet/item100/r-20160580.jpg?_ex=128x128,,https://thumbnail.image.rakuten.co.jp/@0_mall/tokyo-cosmetics/cabinet/item102/item102/imgrc0074992186.jpg?_ex=64x64,https://thumbnail.image.rakuten.co.jp/@0_mall/tokyo-cosmetics/cabinet/item100/r-20160580.jpg?_ex=64x64,,4,https://hb.afl.rakuten.co.jp/hgc/g00qtysg.ppohcee8.g00qtysg.ppohd496/?pc=https%3A%2F%2Fitem.rakuten.co.jp%2Ftokyo-cosmetics%2Fr-20160580%2F&m=http%3A%2F%2Fm.rakuten.co.jp%2Ftokyo-cosmetics%2Fi%2F10158054%2F&rafcid=wsc_i_is_1053351987856881203,,,0,1,,503106,0,1,メール便をご利用の方は必ず以下ページをご確認ください。 社名変更により製造時期によって新旧異なる社名の記載品でのお届けとなる場合がございます。また、社名変更にともない商品のパッケージが画像とは異なる場合がございます。あらかじめご了承くださいませ。新社名「FMGMISSION (エフエムジー & ミッション)」 旧社名「エイボン」 メーカー希望小売価格はメーカーカタログに基づいて掲載しています。 リップライン用。美しいラインが描けます。 口紅のにじみ防止に。 ●メーカー エイボン●区分 　日本製・化粧品アップ●分類 　リップライナー●広告文責 株式会社ルージュ 03-3980-1585テスター品 試用見本品 半額以下な掘り出しもの満載 噂の『特価品』はココをクリック外箱不良 箱つぶれ 箱なし 難あり 在庫処分 キズ有 アウトレットなどですが激レアな商品が見つかるかも…商品の発売日・カラー種類・タイプなどの商品の詳細情報につきましては各商品の発売元・製造メーカーに直接お問い合わせください。それらのお問い合わせおよび特価品に関するご質問は一切お答えしません。ご了承ください。ご注文その他の事を問い合わせ希望の方はご質問前にこちらのページをよくお読みください。よくある質問集,tokyo-cosmetics:10158054,AVON エイボン ソフト スティック リップライナー 【メール便対象品】,440,item_price_min3,440,440,440,440,440,440,https://hb.afl.rakuten.co.jp/hgc/g00qtysg.ppohcee8.g00qtysg.ppohd496/?pc=https%3A%2F%2Fitem.rakuten.co.jp%2Ftokyo-cosmetics%2Fr-20160580%2F&m=http%3A%2F%2Fm.rakuten.co.jp%2Ftokyo-cosmetics%2Fi%2F10158054%2F&rafcid=wsc_i_is_1053351987856881203,1,,,1,4,1,アルゼンチン/オーストリア/オーストラリア/ベルギー/ブラジル/カナダ/スイス/中国/ドイツ/デンマーク/スペイン/フランス/英国/ギリシャ/香港/インドネシア/インド/イタリア/韓国/モロッコ/メキシコ/マレーシア/オランダ/ニュージーランド/フィリピン/ポーランド/ポルトガル/スウェーデン/シンガポール/タイ/トルコ/台湾/アメリカ/ベトナム,1,https://hb.afl.rakuten.co.jp/hgc/g00qtysg.ppohcee8.g00qtysg.ppohd496/?pc=https%3A%2F%2Fwww.rakuten.co.jp%2Ftokyo-cosmetics%2F&m=http%3A%2F%2Fm.rakuten.co.jp%2Ftokyo-cosmetics%2F&rafcid=wsc_i_is_1053351987856881203,tokyo-cosmetics,東京コスメティック,0,https://hb.afl.rakuten.co.jp/hgc/g00qtysg.ppohcee8.g00qtysg.ppohd496/?pc=https%3A%2F%2Fwww.rakuten.co.jp%2Ftokyo-cosmetics%2F&m=http%3A%2F%2Fm.rakuten.co.jp%2Ftokyo-cosmetics%2F&rafcid=wsc_i_is_1053351987856881203,,,0
